001:007:003:DESCRIPTOR         1521934956.574341
 05 01 09 05 A1 01 85 01 09 30 09 31 09 32 09 35
 15 00 26 FF 00 75 08 95 04 81 02 09 39 15 00 25
 07 35 00 46 3B 01 65 14 75 04 95 01 81 42 65 00
 05 09 19 01 29 0E 15 00 25 01 75 01 95 0E 81 02
 06 00 FF 09 20 75 06 95 01 15 00 25 7F 81 02 05
 01 09 33 09 34 15 00 26 FF 00 75 08 95 02 81 02
 06 00 FF 09 21 95 36 81 02 85 05 09 22 95 1F 91
 02 85 04 09 23 95 24 B1 02 85 02 09 24 95 24 B1
 02 85 08 09 25 95 03 B1 02 85 10 09 26 95 04 B1
 02 85 11 09 27 95 02 B1 02 85 12 06 02 FF 09 21
 95 0F B1 02 85 13 09 22 95 16 B1 02 85 14 06 05
 FF 09 20 95 10 B1 02 85 15 09 21 95 2C B1 02 06
 80 FF 85 80 09 20 95 06 B1 02 85 81 09 21 95 06
 B1 02 85 82 09 22 95 05 B1 02 85 83 09 23 95 01
 B1 02 85 84 09 24 95 04 B1 02 85 85 09 25 95 06
 B1 02 85 86 09 26 95 06 B1 02 85 87 09 27 95 23
 B1 02 85 88 09 28 95 22 B1 02 85 89 09 29 95 02
 B1 02 85 90 09 30 95 05 B1 02 85 91 09 31 95 03
 B1 02 85 92 09 32 95 03 B1 02 85 93 09 33 95 0C
 B1 02 85 A0 09 40 95 06 B1 02 85 A1 09 41 95 01
 B1 02 85 A2 09 42 95 01 B1 02 85 A3 09 43 95 30
 B1 02 85 A4 09 44 95 0D B1 02 85 A5 09 45 95 15
 B1 02 85 A6 09 46 95 15 B1 02 85 F0 09 47 95 3F
 B1 02 85 F1 09 48 95 3F B1 02 85 F2 09 49 95 0F
 B1 02 85 A7 09 4A 95 01 B1 02 85 A8 09 4B 95 01
 B1 02 85 A9 09 4C 95 08 B1 02 85 AA 09 4E 95 01
 B1 02 85 AB 09 4F 95 39 B1 02 85 AC 09 50 95 39
 B1 02 85 AD 09 51 95 0B B1 02 85 AE 09 52 95 01
 B1 02 85 AF 09 53 95 02 B1 02 85 B0 09 54 95 3F
 B1 02 85 B1 09 55 95 02 B1 02 85 B2 09 56 95 02
 B1 02 85 E0 09 57 95 02 B1 02 85 B3 09 55 95 3F
 B1 02 85 B4 09 55 95 3F B1 02 C0

